NAME OF FACILITY,COMPLETE ADDRESS
AGUIRRE EYE & ENT SPECIALIST,"G/F Adame Bldg., Arnaldo Blvd., Roxas City, Capiz"
BOROUGH LASIK CENTER,"Unit 827 Second floor, Festive Walk Mall, iloilo City, Iloilo"
MEDICUS AMBULATORY HEALTHCARE CENTER,"8/F Health Partners Condo. Clinics, Benigno Aquino Ave., San Rafael, Mandurriao, Iloilo City"
MIDWEST UROLOGY AND STONE CENTER,"G/F EFB Block, Jalandoni St., Jaro, Iloilo City"
SKINETICS MEDICAL DAY SPA & SKIN CENTER,"YGQ Bldg., Pacencia Pison Avenue, San Rafael, Mandurriao, Iloilo City"
HOLY TRINITY MEDICAL SURGICAL CLINIC,"Barrio Mabini, Crossing Pulupandan, Negros Occidental"
