name,health-resource,address,lat,long
ATHEENA BLISS PHARMACY,pharmacy,"PUROK 4, MINOYAN, MURCIA NEGROS OCCIDENTAL, Murcia, Negros Occidental",,
D-REYES PHARMACY,pharmacy,"Jalandoni Building, Villa Ercelia, San Miguel, Jordan, Guimaras",,
WD DRUGSTORE,pharmacy,"IMPORTANTE, TIBIAO ANTIQUE, Tibiao, Antique",,
Belarmino Drugstore,pharmacy,"Poblacion, Altavas, Aklan",,
GALT'Z MEDICAL CLINIC AND PHARMACY,pharmacy,"New Site, Jordan, Guimaras, Western Visayas (Region VI), 5045, Jordan, Guimaras",,
PHARMASAVE PHARMACY,pharmacy,"Mesias Bldg. Gomez St., Silay City, Negros Occidental",,
LIFECURE PHARMACY,pharmacy,"SHOP #4, SE LA SOR BUILDING, BRGY. CABANBANAN, Oton, Iloilo",,
CONFLUENCE HEALTH AND WELLNESS PRODUCTS,pharmacy,"Ground Floor, Injap Supermart, Arnaldo Boulevard, Baybay, Roxas, Capiz, Western Visayas (Region VI), 5800, Roxas, Capiz",,
ADN PHARMACY,pharmacy,"Brgy. Poblacion, Batad, Iloilo, Western Visayas (Region VI), 5016, Batad, Iloilo",,
M PHARMACY,pharmacy,"BALASAN PUBLIC MARKET,BRGY. POBLACION NORTE, BALASAN, ILOILO, Balasan, Iloilo",,
MERCURY DRUG,pharmacy,"Quimpo Bldg., Archbishop Reyes St., Poblacion, Kalibo, Aklan, Western Visayas (Region VI), 5600, Kalibo, Aklan",,
LOURDES PHARMACY,pharmacy,"Corner Dioso St., National Rd., Brgy. Centro Poblacion, Culasi, Antique, Culasi, Antique",,
YOUSAVE DRUGSTORE,pharmacy,"Zone 4-A (Pob.), Talisay, Negros Occidental",,
Farmacia Rescate,pharmacy,"Toting Reyes Street, Kalibo, Aklan",,
Farmacia Gomez,pharmacy,"Kalibo Shopping Center, Kalibo, Aklan",,
JDN Pharmacy &amp; Medical Supplies,pharmacy,"LUCKY HOMES SUBDIVISION BARANGAY HANDUMANAN, Bacolod City, Negros Occidental",,
S &amp; G Drugstore,pharmacy,"Room 2 Benelio Arcade, Pandac, Pavia, Iloilo",,
LHL PHARMACY,pharmacy,"Villareal Hi-way, Poblacion Proper, Mambusao, Capiz, Western Visayas (Region VI), 5807, Mambusao, Capiz",,
"ROSE PHARMACY, INCORPORATED",pharmacy,"132 J.M. Basa St., Iloilo City, Iloilo, Western Visayas (Region VI), 5000, Iloilo City, Iloilo",,
SOUTH STAR DRUG,pharmacy,"Robinson Supermarket, Alijis Road, Carmenville Subd. Brgy. Mansilingan, 6100, Bacolod, Negros Occidental",,
GENERIKA DRUGSTORE,pharmacy,"Fenete St., District III, Sibalom, Antique, Western Visayas (Region VI), 5713, Sibalom, Antique",,
VALDEMAR DRUGSTORE,pharmacy,"Poblacion, Jamindan, Capiz, Western Visayas (Region VI), 5808, Jamindan, Capiz",,
Fastlane Pharmacy,pharmacy,"B2 L1 Corner Landheights 2 &amp; Quezon Street, Areval, Iloilo, Iloilo City, Iloilo",,
ROSE PHARMACY,pharmacy,"Rizal St., Brgy. Rizal-Tuguisan, Guimbal, Iloilo, Western Visayas (Region VI), 5022, Guimbal, Iloilo",,
PARSIA PHARMACY,pharmacy,"Purok 5, San Joaquin, Iloilo, Western Visayas (Region VI), 5024, San Joaquin, Iloilo",,
FARMACIA NI DOK,pharmacy,"Sitio Sibucao, Semirara, Caluya, Antique, Western Visayas (Region VI), 5711, Caluya, Antique",,
ROSE PHARMACY  INCORPORATED,pharmacy,"Gaisano City, Lapaz, Iloilo City, Iloilo",,
888 DRUGCARE PHARMACY,pharmacy,"Lot 2 Block 11 Carmen J. Ledesma Village, Tacas, Jaro, Iloilo City, Iloilo",,
LOIZ PHARMACY,pharmacy,"CEEJ Building, Brgy Pakiad, Oton, Iloilo",,
J. Cabatbat Pharmacy,pharmacy,"R. Tabiana Street Brgy. Poblacion, Leon Iloilo, Leon, Iloilo",,
THE GENERICS PHARMACY,pharmacy,"HL Bldg., Brgy. Tagbak, Jaro, Iloilo City, Iloilo, Western Visayas (Region VI), 5000, Iloilo City, Iloilo",,
JUNE GAYCELLYN'S PHARMACY,pharmacy,"Poblacion, Libacao, Aklan",,
"METRO RETAIL STORES GROUP, INC.",pharmacy,"Ground Floor, Ayala Malls, Capitol Central, Gatuslao Street, Barangay 8, Bacolod, Negros Occidental, Negros Island Region, 6100, Bacolod, Negros Occidental",,
DIVINE PROVIDER PHARMACY,pharmacy,"Brgy. Poblacion Ilaud, Zarraga, Iloilo",,
Good Rx Pharmacy,pharmacy,"GA Valencia Building, 10 District of Arevalo, Bgry. Sta. Filomena, Arevalo, Iloilo City, Iloilo",,
JCCO PHARMACY,pharmacy,"B74D L18 ZONE 5, ABADA ESCAY, VISTA ALEGRE, Bacolod City, Negros Occidental",,
VERGEL'S PHARMACY,pharmacy,"Purok 3-Highway, Brgy. Minoyan, Murcia, Negros Occidental",,
Negros Grace Pharmacy,pharmacy,"Araneta St., Barangay 12, Bacolod, Negros Occidental",,
QT PHARMACY,pharmacy,"M.H. del Pilar Street, Ilaud Poblacion, Barotac Nuevo, Iloilo",,
NEGROS GRACE PHARMACY,pharmacy,"Gaisano City Mall Araneta St., Singcang-Airport, Bacolod, Negros Occidental",,
DAILY DOSE PHARMACY,pharmacy,"RM 104 VSB BLDG. 6TH ST. LACSON, BRGY. 7, Bacolod City, Negros Occidental",,
ADAH'S PHARMACY,pharmacy,"Rizal St., La Castellana, Negros Occidental, Negros Island Region, 6131, La Castellana, Negros Occidental",,
DOMINICS PHARMACY,pharmacy,"M. CHAVEZ, San Lorenzo, Guimaras, Western Visayas (Region VI), 5047, San Lorenzo, Guimaras",,
THE GENERICS PHARMACY,pharmacy,"San Roque Extension, Roxas, Capiz, Western Visayas (Region VI), 5800, Roxas, Capiz",,
MERCURY DRUG,pharmacy,"Jetty Port, Caticlan,, Malay, Aklan, Western Visayas (Region VI), 5608, Malay, Aklan",,
MERCURY DRUG,pharmacy,"Dumalag Road, Brgy. Poblacion, Tabuc, Mambusao, Capiz, Western Visayas (Region VI), 5807, Mambusao, Capiz",,
BIOMEDIX PHARMACY AND SUPPLIES,pharmacy,"RSP Bldg., T. A. Fornier St., Brgy. 7, San Jose, Antique",,
JM'S DRUGSTORE,pharmacy,"Poblacion, Nabas, Aklan, Western Visayas (Region VI), 5607, Nabas, Aklan",,
Maxy Pharmacy,pharmacy,"Real St., Brgy. Hipona, Pontevedra, Capiz",,
GREGORI PHARMACY,pharmacy,"MAQUILING STREET BARANGAY PUROK II, PAVIA ILOILO, Pavia, Iloilo",,
ROSE PHARMACY,pharmacy,"104 Lopez Jaena St., Brgy. San Isidro, Jaro, Iloilo City, Iloilo",,
FAMILEE PHARMA AND MEDICAL SUPPLIES TRADING,pharmacy,"ZONE 1 BARANGAY BALDOZA, LAPAZ, Iloilo City, Iloilo",,
GRACE PHARMACY,pharmacy,"St. Anne's Bldg., 13th Lacson St., Barangay 4, Bacolod, Negros Occidental",,
NEPCURIE DRUGSTORE,pharmacy,"Bangga Bante, Zarraga, Iloilo, Western Visayas (Region VI), 5004, Zarraga, Iloilo",,
MERCURY DRUG,pharmacy,"E. Lizares Bldg., Mabini St., Brgy. Zone 4-A, Talisay, Negros Occidental, Negros Island Region, 6115, Talisay, Negros Occidental",,
NEGROS GRACE PHARMACY,pharmacy,"Lopue's San Sebastian Bldg., Brgy. Gargato, Hinigaran, Negros Occidental",,
NEGROS GRACE PHARMACY,pharmacy,"Blk. 3, Lot 11 &amp; 12 Fortune Towne, Brgy. Estefania, Bacolod, Negros Occidental",,
NEGROS GRACE PHARMACY,pharmacy,"B.S. Aquino Drive, Capitol Shopping Center, Villamonte, Bacolod, Negros Occidental",,
Negros Grace Pharmacy,pharmacy,"GF A1-3, Gaisano Capital, F.C. Ledesma Ave., Brgy. Palampas,, San Carlos, Negros Occidental, Negros Island Region, 6127, San Carlos, Negros Occidental",,
JAN VEY PHARMACY,pharmacy,"Somes St., Pob. Zone II, Estancia, Iloilo, Western Visayas (Region VI), 5017, Estancia, Iloilo",,
FAMILYHEALTH &amp; BEAUTY CORP.,pharmacy,"GF Savemore Market Sta. Barbara Iloilo, Zone 3, Arroyo St., Sta. Barbara, Iloilo City, Iloilo, Western Visayas (Region VI), 5000, Iloilo City, Iloilo",,
FAMILYHEALTH &amp; BEAUTY CORP.,pharmacy,"Puregold Jaro El 98 Road corner Cuartero St., Barangay Cuartero, Iloilo City, Iloilo, Western Visayas (Region VI), 5000, Iloilo City, Iloilo",,
The Generics Pharmacy,pharmacy,"Centro Poblacion, Culasi, Antique",,
GOOD MARIA PHARMACY,pharmacy,"Brgy. Poblacion, Sapi-An, Capiz",,
THE GENERICS PHARMACY,pharmacy,"IYA Bldg., E. Nietes Ave., Trade Town, Brgy. Funda-Delipe, San Jose, Antique, Western Visayas (Region VI), 5700, San Jose, Antique",,
TRES NINAS PHARMACY,pharmacy,"Poblacion VII (Barangay VII), Roxas, Capiz, Western Visayas (Region VI), 5800, Roxas, Capiz",,
GENERIKA DRUGSTORE,pharmacy,"Lucero St., Poblacion Ilaya, Lambunao, Iloilo, Western Visayas (Region VI), 5042, Lambunao, Iloilo",,
MERCURY DRUG,pharmacy,"La Estrella Bldg., Roxas Avenue Extension, Brgy. Andagao, Kalibo, Aklan, Western Visayas (Region VI), 5600, Kalibo, Aklan",,
JB TAN PHARMACY,pharmacy,"Block 63 Lot 64 Deca Homes South Bacolod, Bacolod City, Negros Occidental",,
NEGROS GRACE PHARMACY,pharmacy,"Lopez Jaena St., Brgy. 1, Pob., Hinigaran, Negros Occidental",,
Mercury Drug,pharmacy,"SIL-GFS-4&5, Ground Floor, Gaisano Grand Mall, Rizal St., Barangay Mambulac, Silay, Negros Occidental, Negros Island Region, 6116, Silay, Negros Occidental",,
TG &amp; D DRUGSTORE,pharmacy,"PUROK ILKO, BRGY. CADUHA-AN, Cadiz City, Negros Occidental",,
THE GENERICS PHARMACY,pharmacy,"DON PEDRO R. YULO ST., STO. ROSARIO, Binalbagan, Negros Occidental",,
THEA'S PHARMACY,pharmacy,"Mabini St., Kalibo, Aklan, Western Visayas (Region VI), 5600, Kalibo, Aklan",,
GREEN LIVING PHARMACY,pharmacy,"St. Teresa Residences I, Rosario DoÃ±a Juliana St., Barangay 33, Bacolod, Negros Occidental",,
MERCURY DRUG,pharmacy,"Corner Lacson-Burgos Sts., Brgy. 18, Bacolod, Negros Occidental, Negros Island Region, 6100, Bacolod, Negros Occidental",,
JHIME DRUGSTORE,pharmacy,"San Jose St., Pototan, Iloilo, Western Visayas (Region VI), 5008, Pototan, Iloilo",,
RenaÃ¢â‚¬â„¢s Pharmacy,pharmacy,"DB OÃ‘ATE ST, POBLACION, Conception, Iloilo",,
GRW DRUGSTORE,pharmacy,"DOKI REALTY INC., TOTING REYES ST., ANDAGAO, Kalibo, Aklan",,
NL CORNER PHARMACY,pharmacy,"NEW LUCENA PUBLIC MARKET, POBLACION, New Lucena, Iloilo",,
SINCERE DRUGSTORE,pharmacy,"COR. LIBERTAD-VERBENA ST., Bacolod, Negros Occidental",,
ST. JUDE PHARMA AND MEDICAL SUPPLIES TRADING,pharmacy,"SITIO PROPER-B, BARANGAY DASAL, Sibunag, Guimaras",,
CCRJ PHARMACY,pharmacy,"Brgy. Poblacion, San Rafael, Iloilo",,
THE GENERICS PHARMACY,pharmacy,"Stall No. 9&10, Kalibo Public Market, Roxas Ave. Ext., Andagao, Kalibo, Aklan",,
NEGROS GRACE PHARMACY,pharmacy,"Lot 2 Blk. 2, Bacolod Murcia Road, Brgy. Mansilingan,, Bacolod, Negros Occidental, Negros Island Region, 6100, Bacolod, Negros Occidental",,
FAMILYHEALTH &amp; BEAUTY CORP.,pharmacy,"Zone V - Bolabog, Barangay Balabag, Boracay Island, Malay, Aklan, Western Visayas (Region VI), 5608, Malay, Aklan",,
FAMILYHEALTH &amp; BEAUTY CORP.,pharmacy,"G/F Sm Hypermarket Iloilo, Commission Civil cor. Jalandoni Sts., Jaro, Iloilo City, Iloilo, Western Visayas (Region VI), 5000, Iloilo City, Iloilo",,
FAMILYHEALTH &amp; BEAUTY CORP.,pharmacy,"GF Gaisano Grand Estancia, E. Reyes Avenue, Poblacion Zone II, Estancia, Iloilo, Western Visayas (Region VI), 5017, Estancia, Iloilo",,
JOSA PHARMACY,pharmacy,"31 G/F Public Market, Brgy. Ilaud Poblacion, Barotac Nuevo, Iloilo",,
AG JR PHARMACY,pharmacy,"Rizal St., Pala-pala, Iloilo City, Iloilo",,
J and S Drugstore,pharmacy,"Lot 2 Blk 2 Westville Subdivision, Pandac, Pavia, Iloilo",,
BOTICA SA PAROKYA,pharmacy,"BUENAFLOR ST., Dumangas, Iloilo",,
BULAO DRUGSTORE,pharmacy,"Brgy. San Jose, Sipalay City, Altavas, Negros Occidental, Negros Island Region, 6100, Altavas, Negros Occidental",,
FAMILYHEALTH &amp; BEAUTY CORP.,pharmacy,"Savemore Market, Suvil Town Center Barangay Inangayan, Santa Barbara, Iloilo",,
EC LUMANOG PHARMACY,pharmacy,"Block 43A, Escalante Shopping Center, Barangay Balintawak, Poblacion, Escalante City Negros Occidental, Escalante City, Negros Occidental",,
FARMACIA LEYMA,pharmacy,"Freedom Street, Brgy. Pob. SE Zone, Lemery, Iloilo, Western Visayas (Region VI), 5043, Lemery, Iloilo",,
"Vios Integrated Projects (VIP), Inc.",pharmacy,"B4 L7 5th St., Lawaan Village, Balantang, Jaro, Iloilo City, Iloilo",,
BARBAZA RURAL HEALTH UNIT AND BIRTHING CENTER,pharmacy,"Poblacion 2, Barbaza, Antique, Western Visayas (Region VI), 5706, Barbaza, Antique",,
BOTIKA NI MAU,pharmacy,"Tabuc Sur,, Panitan, Capiz, Western Visayas (Region VI), 5815, Panitan, Capiz",,
C.R.H. DRUGSTORE,pharmacy,"BGY. CABANBANAN OTON, ILOILO, Oton, Iloilo",,
ILOILO GRACE PHARMACY,pharmacy,"# 5 General Luna Street, Iloilo City, Iloilo, Western Visayas (Region VI), 5000, Iloilo City, Iloilo",,
RX MED PHARMACY,pharmacy,"Barangay West Timawa, Molo, Iloilo City, Iloilo",,
CONFLUENCE HEALTH &amp; WELLNESS PRODUCTS,pharmacy,"LGF SM City, Brgy. Bolilao, Mandurriao, Iloilo City, Iloilo, Western Visayas (Region VI), 5000, Iloilo City, Iloilo",,
Antays Pharmacy,pharmacy,"Arroyo street Santa Barbara, Iloilo, Iloilo",,
VINCE'S PHARMA AND MEDICAL SUPPLIES TRADING,pharmacy,"San Antonio, Sum-ag, Bacolod City, Negros Occidental",,
IMMUNOTX PHARMACY,pharmacy,"BANTUD, MANOC MANOC, Malay, Aklan",,
NEGROS GRACE PHARMACY,pharmacy,"Lot 2-B, Blk. 31, Brgy. Bata, Bacolod, Negros Occidental",,
BACTING PHARMACY,pharmacy,"Barangay Poblacion, Banate, Iloilo, Western Visayas (Region VI), 5010, Banate, Iloilo",,
"Vaximax Marketing Ventures, Inc.",pharmacy,"2/F Unit 226-227 Nolan Bldg. Cor. San Agustin B.S. Aquino Drive, Barangay 5  City of Bacolod, Bacolod City, Negros Occidental",,
CORNERMED PHARMACY,pharmacy,"Highway North, Poblacion Ilawod, Lambunao, Iloilo, Lambunao, Iloilo",,
NINE KID'S PHARMACY,pharmacy,"San Enrique Public Market, Poblacion Ilaya, San Enrique, Iloilo",,
BOTICA CAMACHO,pharmacy,"Public Market, Lambunao, Iloilo, Western Visayas (Region VI), 5042, Lambunao, Iloilo",,
LOBATON PHARMA AND MEDICAL SUPPLIES TRADING,pharmacy,"Brgy. Ilaya 1st, Dumangas, Iloilo",,
MERCURY DRUG,pharmacy,"National Highway, Escalante, Negros Occidental, Negros Island Region, 6124, Escalante, Negros Occidental",,
BIOPRO HEALTH AND LABORATORY SERVICES CORPORATION,pharmacy,"Purok 1, Montelibano Street, Granada, Bacolod City, Negros Occidental",,
FAMILYHEALTH &amp; BEAUTY CORP.,pharmacy,"Florentina Arcade, Brgy. Sum-ag, Bacolod City, Negros Occidental",,
Ricarse Pharmacy,pharmacy,"Gurrea Street, barangay 3,La carlota City Negros Occidental, La Carlota City, NEGROS OCCIDENTAL",,
FAITH PHARMACY,pharmacy,"LOT 52 AND 54 BLK 25 MARGARITA ST. ERORECO VILLAGE, MANDALAGAN, Bacolod City, Negros Occidental",,
JEDSEL DRUGSTORE,pharmacy,"Purok 3, Lot No. 1185-A, Brgy. Granada, Bacolod City, Negros Occidental",,
Vonmed Pharma Distributor,pharmacy,"MJ Bldg. Mabini Street, Barangay Liberation, Iloilo City, Iloilo",,
ROSE PHARMACY,pharmacy,"Gustilo Street, Barangay Five, San Carlos, Negros Occidental, Negros Island Region, 6127, San Carlos, Negros Occidental",,
GENERIKA DRUGSTORE,pharmacy,"Rizal Street, Barangay II-Poblacion, Himamaylan, Negros Occidental",,
MERCURY DRUG,pharmacy,"Burgos Extension, Brgy. Villamonte, Bacolod City, Negros Occidental",,
"FAMILYHEALTH &amp; BEAUTY CORP.,",pharmacy,"GF City Mall Mandalagan, Lacson St., Cor. GM Cordova Ave., Brgy. Mandalagan, Bacolod, Negros Occidental",,
SINCERE DRUGSTORE,pharmacy,"DE LA RAMA BLDG., LUZURIAGA ST., Bacolod, Negros Occidental",,
JESELLE PHARMACY,pharmacy,"Fenete St, Sibalom, Antique",,
GENERIKA DRUGSTORE,pharmacy,"Guanzon St., Brgy. 1, Kabankalan, Negros Occidental, Negros Island Region, 6111, Kabankalan, Negros Occidental",,
GENERIKA DRUGSTORE,pharmacy,"Purok Sunshine, Poblacion II, Sagay, Negros Occidental, Negros Island Region, 6122, Sagay, Negros Occidental",,
FAMILYHEALTH &amp; BEAUTY CORP.,pharmacy,"GF Sacred Heart Place, Barangay Q. Abeto-Mirasol, Mandurriao, Iloilo City, Iloilo, Western Visayas (Region VI), 5000, Iloilo City, Iloilo",,
3 Angels Pharmacy,pharmacy,"#55 Lot 3 Blk. 25, PHHC Phase 1 Mandurriao, Iloilo City, Iloilo",,
C&amp;R Pharmacy,pharmacy,"Jalandoni St. Mallery Building Brgy. Lantad, Silay City , Negros Occidental",,
THE GENERICS PHARMACY,pharmacy,"SPS Joseph & Anabel Solis Bldg., San Sebastian St., Brgy. Poblacion, Jamindan, Capiz",,
FERVIC PHARMACY,pharmacy,"Mina-Janiuay Road, Aquino Nobleza West, Janiuay, Iloilo",,
GILLET PHARMACY,pharmacy,"Mohon Dry & Wet Market, Brgy. San Nicolas, Oton, Iloilo",,
FLORYANA DRUGSTORE,pharmacy,"ALX BUILDING, BRGY. JIBOLO, Janiuay, Iloilo",,
MERCURY DRUG,pharmacy,"G/F West Arcade, Robinson's Place Bacolod, Lacson St., Barangay Mandalagan, Bacolod, Negros Occidental",,
R & E PHARMACY,pharmacy,"Salvani St., Poblacion, Patnongon, Antique",,
YOUSAVE DRUGSTORE,pharmacy,"Zone 4-A (Pob.), Talisay, Negros Occidental",,
KSERF PHARMACY,pharmacy,"Alfelor St., Passi, Iloilo",,
JSJ PHARMACY,pharmacy,"Tulubhan, Brgy. Manocmanoc, Malay, Aklan",,
MERCURY DRUG ,pharmacy,"Gov. Villavert St., Barangay 8, San Jose, Antique",,
CONFLUENCE HEALTH AND WELLNESS PRODUCTS,pharmacy,"Susana Bldg. III, T.A. Fornier St., Barangay 6, San Jose, Antique",,
THE GENERICS PHARMACY,pharmacy,"MAGALLANES ST., PUBLIC MARKET, Isabela, Negros Occidental",,
NEGROS GRACE PHARMACY,pharmacy,"Blk. DMC-C, Dry Market, Murcia Tinabuay Market, Murcia, Negros Occidental",,
ROSE PHARMACY,pharmacy,"Anacleta Bldg., cor., Burgos-Magdalo Sts., Brgy. Magdalo, La Paz, Iloilo City, Iloilo",,
ROSE PHARMACY,pharmacy,"E. Lopez St., corner Javellana, Jaro, Iloilo City, Iloilo",,
FAMILYHEALTH & BEAUTY CORP.,pharmacy,"G/F Sm Hypermarket Iloilo, Commission Civil cor. Jalandoni Sts., Jaro, Iloilo City, Iloilo",,
MERCURY DRUG,pharmacy,"Bypass Road, Brgy. San Sebastian, Santa Barbara, Iloilo",,
THE GENERICS PHARMACY,pharmacy,"Kiosk D-20 Triangle,  Island Plaza Mall Shopping Center,  B. S. Aquino Drive, Brgy. Villamonte, Bacolod, Negros Occidental",,
PRODRUG PHARMACY,pharmacy,"Stall #30 Mina Public Market, Brgy. Cabalabaguan, Mina, Iloilo",,
BOTIKA NI BIGOT,pharmacy,"Poblacion, Brgy. Igmaya-an, Salvador Benedicto, Negros Occidental",,
ILOILO GRACE PHARMACY,pharmacy,"E. Lopez., St., Jaro, Iloilo City, Iloilo",,
AMBEX PHARMA,pharmacy,"BAILAN, Pontevedra, Capiz",,
MORNING STAR DRUGSTORE,pharmacy,"Pueblo de Panay, Barangay Lawa-an, Roxas, Capiz",,
ANGELA'S SAVER PHARMACY,pharmacy,"Uy, Eco-Tourism Highway, Brgy. Rizal, San Carlos, Negros Occidental",,
FARMACIA NI DOK,pharmacy,"New Buswang, Kalibo, Aklan",,
 LLA MEDICAL DENTAL TRADING ,pharmacy,"St. Elizabeth Center, Valeria Street, Brgy. Danao, Iloilo City, Iloilo",,
SOFITED PHARMA,pharmacy,"#3 Tupan St., Brgy. 5, Tigbauan, Iloilo",,
KSTS PHARMACY,pharmacy,"Brgy. Dalid, Calinog, Iloilo",,
THE GENERICS PHARMACY,pharmacy,"Unit R8-A Ground Floor, Prince Town LCC, Brgy. II Poblacion, La Carlota, Negros Occidental",,
MERCURY DRUG,pharmacy,"Mabini-Libertad St., Brgy. 40, Bacolod, Negros Occidental",,
FARMACIA SAMPANE,pharmacy,"Zone 2, Brgy. Bacuyangan, Hinoba-an, Negros Occidental",,
J AND H PHARMACY,pharmacy,"1008 Romero Bldg., Roxas Ave., Poblacion, Kalibo, Aklan",,
FAMILYHEALTH & BEAUTY CORP.,pharmacy,"GF Gaisano Grand Estancia, E. Reyes Avenue, Poblacion Zone II, Estancia, Iloilo",,
GAUDITE PHARMACY,pharmacy,"Ground Floor Fanega-Gaudite Building, Araneta St., Brgy. Poblacion, Bago, Negros Occidental",,
THE GENERICS PHARMACY,pharmacy,"Garrido St., Brgy.  Poblacion Ilaya, San Enrique, Iloilo",,
NEGROS GRACE PHARMACY,pharmacy,"#13 Tai Guan Bldg., Luzuriaga St., Bacolod, Negros Occidental",,
THE GENERICS PHARMACY,pharmacy,"Stall A, Aquino Drive, 20th St., Bacolod, Negros Occidental",,
A & M MEDCARE PRODUCT DISTRIBUTORS,pharmacy,"Lacson 5th Street, Brgy. 17, Bacolod, Negros Occidental",,
JDN PHARMACY AND MEDICAL SUPPLIES,pharmacy,"Barangay Estefania, Bacolod, Negros Occidental",,
KD DRUGSTORE,pharmacy,"Lot 22 Block 29 Dona Carmen Avenue, Brgy. Alijis, Bacolod, Negros Occidental",,
THE GENERICS PHARMACY,pharmacy,"J. Tolosa St., Caticlan, Malay, Aklan",,
THE GENERICS PHARMACY,pharmacy,"Barangay Buenaflor-Embarcadero, Dumangas, Iloilo",,
JUANITES PHARMACY,pharmacy,"Poblacion, Barbaza, Antique",,
BENZ PHARMACY,pharmacy,"Door #1 ADR Building, Bonifacio Street, Brgy. Zone 6, Talisay, Negros Occidental",,
BABE DELA CRUZ PHARMACY,pharmacy,"2014 Mabini St., Poblacion, Kalibo, Aklan",,
DRAG N SHOP PHARMACY,pharmacy,"AJL Bldg., General Luna St., Brgy. Villa Anita, Iloilo City, Iloilo",,
GEBIX PHARMA PRODUCTS MARKETING ,pharmacy,"Brgy. Tabucan,  , Barotac Nuevo, Iloilo",,
MEDEXPRESS DRUGSTORE,pharmacy,"TDHI Clinic Central, B.S. Aquino Drive, Barangay Villamonte, Bacolod, Negros Occidental",,
MERCURY DRUG,pharmacy,"Door 2 Sia-Chan Lek Bldg., National Road, cor. Dalisay St., Barangay Poblacion, Ibajay, Aklan",,
FARMACIA NI DOK,pharmacy,"Lot No. 2 and 3, 8th St. Lawa-an Lopez Village, Brgy. Balantang, Jaro, Iloilo City, Iloilo",,
GENERIKA DRUGSTORE,pharmacy,"De leon St., Brgy. II, Victorias, Negros Occidental",,
NEGROS GRACE PHARMACY,pharmacy,"Corner Doña Carmen Avenue, Brgy. Alijis, Bacolod, Negros Occidental",,
DRUG R US,pharmacy,"Poblacion, Tapaz, Capiz",,
ST. THERESA PHARMACY,pharmacy,"National Highway, Poblacion (Payabon), Bindoy, Negros Occidental",,
JDN-MK PHARMACY AND MEDICAL SUPPLIES,pharmacy,"Bangga Laurel, J.J Gonzaga Street, Barangay Mansilingan, Bacolod, Negros Occidental",,
MERCURY DRUG,pharmacy,"Villena St., Brgy. Zone-2, Cadiz, Negros Occidental",,
FARMACIA NI DOK,pharmacy,"Rizal St., Poblacion, New Washington, Aklan",,
SOUTH STAR DRUG,pharmacy,"Oñate St., Brgy. Oñate De Leon, Mandurriao, Iloilo City, Iloilo",,
FAMILYHEALTH & BEAUTY CORP.,pharmacy,"Ground Floor Stall (SIL-GFS-16,17,18,19) Gaisano Grand Mall Silay, Rizal St., Brgy. Mambulac, Silay, Negros Occidental",,
LIL NICO'S PHARMACY,pharmacy,"Mabini St., Brgy. Burgos Mabini Plaza, District of La Paz, Iloilo City, Iloilo",,
DIERON PHARMACY,pharmacy,"Tolosa St., Brgy. 6, Ajuy, Iloilo",,
GENERIKA DRUGSTORE,pharmacy,"Corner Yunque - Virto St., Brgy. II, Poblacion, La Carlota, Negros Occidental",,
JMB POLYCLINIC AND PHARMACY,pharmacy,"San Miguel, Jordan, Guimaras",,
ROSE PHARMACY,pharmacy,"RTU Towncenter cor. Q. Salas/Tacas, Jaro, Iloilo City, Iloilo",,
GOLDEN PHARMA AND MEDICAL SUPPLIES TRADING,pharmacy,"Barangay San Miguel, Jordan, Guimaras",,
MERCURY DRUG,pharmacy,"Alba Bldg., Mabini St., Poblacion, Kalibo, Aklan",,
GENERIKA DRUGSTORE,pharmacy,"Lot 2477-D-1 Oñate St., Brgy. Oñate De Leon, Mandurriao, Iloilo City, Iloilo",,
MERCURY DRUG ,pharmacy,"Emigdio Nietes Ave., Brgy. Funda Dalipe, San Jose, Antique",,
MAKO PHARMACY,pharmacy,"Pob. Tabuc, Maayon, Capiz",,
CAITHLEEN ROSE PHARMACY,pharmacy,"Lot No. 29-A-295 Villena St., Brgy. Pob. 3 (Zone 3), Cadiz, Negros Occidental",,
NEW FARMACIA REGDAL,pharmacy,"184 JP Rizal St., Poblacion Banga, Banga, Aklan",,
FAMILYHEALTH & BEAUTY CORP.,pharmacy,"LGF SM Hypermarket Cadiz, Abelarde St., Cadiz, Negros Occidental",,
FASTLANE DRUGSTORE & MEDICAL CLINIC ,pharmacy,"Barangay. Ungka II, Pavia, Iloilo",,
ALTAVAS DISTRICT HOSPITAL PHARMACY,pharmacy,"Brgy. Poblacion, Altavas, Aklan",,
WILLTHON DRUGSTORE,pharmacy,"Barangay Poblacion VIII, Roxas, Capiz",,
NEGROS GRACE PHARMACY,pharmacy,"Araneta St., Barangay 12, Bacolod, Negros Occidental",,
PFJ PHARMACY,pharmacy,"L1 B1, Providence Negros Subdivision, Barangay Granada, Bacolod, Negros Occidental",,
NEGROS GRACE PHARMACY,pharmacy,"Araneta St., Barangay 12, Bacolod, Negros Occidental",,
MEDSCRIPTS PHARMACY,pharmacy,"Commonwealth Drive (Paho), Brgy. Poblacion Ilawod, Passi, Iloilo",,
MERCURY DRUG ,pharmacy,"Unit A24 G/F, Festive Walk Mall, Brgy. Q. Abeto-Mirasol, Mandurriao District, Iloilo City, Iloilo",,
QUALITY MED PHARMACY,pharmacy,"Oton Public Market, JC Zulueta St., Oton, Iloilo",,
GENERIKA DRUGSTORE,pharmacy,"Stall No. Fl-1, Sigma Public Market, Brgy. Poblacion Norte, Sigma, Capiz",,
THE GENERICS PHARMACY,pharmacy,"Door #3 Villanueva Bldg., Rizal St., Purok Acacia, Zone 2, Murcia, Negros Occidental",,
V'SANDROS PHARMACY,pharmacy,"Cabrera Compound, Lupa, Sitio Cubay, Brgy. Guinhalaran, Silay, Negros Occidental",,
FAMILYHEALTH & BEAUTY CORP.,pharmacy,"G.F. Robinsons Place Roxas, Pueblo de Panay, Brgy. Lawa-an, Roxas, Capiz",,
MERCURY DRUG ,pharmacy,"Gurrea St., La Carlota, Negros Occidental",,
NAZ PHARMA ,pharmacy,"Felix Gorriceta Jr. Avenue, Brgy. Aganan, Pavia, Iloilo , Pavia, Iloilo",,
MERCURY DRUG,pharmacy,"F. Palmares St., Passi, Iloilo",,
ROSE PHARMACY,pharmacy,"Room 102, G/F Maryville Bldg., Delgado St., Iloilo City, Iloilo",,
JDN PHARMACY & MEDICAL SUPPLIES,pharmacy,"MKU Bldg., Brgy. Taculing, Bacolod, Negros Occidental",,
NEGROS GRACE PHARMACY,pharmacy,"Corner Antonio Luna & Rizal Sts., Silay, Negros Occidental",,
THE GENERICS PHARMACY,pharmacy,"Corner Montinola-Arroyo St., Santa Barbara, Iloilo",,
SUJAN'S PHARMACY,pharmacy,"LOT 1, BLOCK 3, ZONE 1, MARGARITA-EVERLASTING ST., BO. OBRERO, Iloilo City, Iloilo",,
"CMS PHARMACY & MEDICAL SUPPLIES, INC.",pharmacy,"Elemar Business Center, San Roque Ext., Roxas, Capiz",,
Negros Grace Pharmacy,pharmacy,"Purok Jasmin, National Highway, Balintawak, Escalante, Negros Occidental",,
RX QUEEN PHARMACY,pharmacy,"Corner Arroyo-Montinola Sts., Brgy. Zone 5, Santa Barbara, Iloilo",,
3 R'S Pharmacy,pharmacy,"Barangay Abaca, Tobias Fornier, Antique, Tobias Fornier, Antique",,
GENERIKA DRUGSTORE,pharmacy,"Corner Yunque - Virto St., Brgy. II, Poblacion, La Carlota, Negros Occidental",,
THE GENERICS PHARMACY,pharmacy,"Rodillon Commercial Space #3, Centro Sur, Pandan, Antique",,
THE GENERICS PHARMACY,pharmacy,"Stall A. Aquino Drive, 20th St., Bacolod, Negros Occidental",,
PARSIA PHARMACY,pharmacy,"Purok 5, San Joaquin, Iloilo",,
NEGROS GRACE PHARMACY,pharmacy,"G/F Lopue's East Centre, Burgos Hilado St., National Highway, Brgy. Villamonte, Bacolod, Negros Occidental",,
CHME BOTIKA MART,pharmacy,"Corner Rodriguez -Yulo St., Purok Million Flower, Brgy. 34, Bacolod, Negros Occidental",,
MERCURY DRUG,pharmacy,"Doors 1-4 Godo Yap Bldg., National Road corner Javier St., Brgy. Centro Poblacion, Culasi, Antique",,
GENERIKA DRUGSTORE,pharmacy,"Lot 12-12-C173 Infante Avenue, Molo, Iloilo City, Iloilo",,
Negros Grace Pharmacy,pharmacy,"Araneta St., Barangay 12, Bacolod, Negros Occidental",,
THE GENERICS PHARMACY,pharmacy,"J. Tolosa St., Caticlan, Malay, Aklan",,
JHIME DRUGSTORE,pharmacy,"San Jose St., Pototan, Iloilo",,
NEK NEK PHARMACY,pharmacy,"Tigbuan Public Market Stall No. 22, Phase I, Brgy. 9, Pob., Tigbauan, Iloilo",,
GENERIKA DRUGSTORE,pharmacy,"Barangay Aquino Nobleza East, Janiuay, Iloilo",,
MAYA'S PHARMACY,pharmacy,"Mojon St.,  Barangay 1, Kabankalan, Negros Occidental",,
ILOILO GRACE PHARMACY,pharmacy,"Javellana Bldg. II, J.M. Basa St., Iloilo City, Iloilo",,
RGT PHARMACY,pharmacy,"Aquino Nobleza St., Janiuay, Iloilo",,
ANIPAN DRUG STORE,pharmacy,"Public Market, Brgy. Centro Norte, Pandan, Antique",,
NEGROS GRACE PHARMACY,pharmacy,"Lot 2-B, Blk. 31, Brgy. Bata, , Bacolod, Negros Occidental",,
