name,health-resource,address,lat,long
LINCONWOOD PHARMACY,pharmacy,"Fontana Woods, Brgy. Gargato, Hinigaran, Negros Occidental",,
BLANCAFLOR DRUGSTORE,pharmacy,"Rizal St., Brgy. IV (Pob.), Himamaylan, Negros Occidental",,
TRIPLE K PHARMACY,pharmacy,"Seth's Bldg., Dumas St., Brgy. San Pedro, Binalbagan, Negros Occidental",,
GENERIKA DRUGSTORE,pharmacy,"Don Pedro R. Yulo St., Barangay Sto. Rosario, Binalbagan, Negros Occidental",,
JASCON DRUGSTORE,pharmacy,"Stall 9 Block 12 Bldg. 3, New Kabankalan Public Market, Brgy. One, Kabankalan, Negros Occidental",,
GENERIKA DRUGSTORE,pharmacy,"Lot 12-12-C173 Infante Avenue, Molo, Iloilo City, Iloilo",,
THE GENERICS PHARMACY,pharmacy,"Gaisano Arcade, Arnaldo Blvd., Roxas, Capiz",,
ROYALMED PHARMACEUTICAL SUPPLIES,pharmacy,"Door A, Huervana St., Brgy. Railway, Lapaz, Iloilo City, Iloilo",,
S & G DRUGSTORE,pharmacy,"Divinagracia, Iloilo City, Iloilo",,
FASTLANE DRUGSTORE & MEDICAL CLINIC,pharmacy,"Brgy. Ungka II, Pavia, Iloilo",,
MERCURY DRUG,pharmacy,"San Roque Ext., Brgy. VIII, Roxas, Capiz",,
TRIPLE-K PHARMACY,pharmacy,"Seth's Bldg., Dumas St., Brgy. San Pedro, Binalbagan, Negros Occidental",,
MKS PHARMACY,pharmacy,"Purok 4, Montelibano St. Brgy. Granada, Bacolod, Negros Occidental",,
MEDINA DRUG STORE,pharmacy,"Agora Public Market, Valois St., Brgy. II, La Carlota City, Bacolod, Negros Occidental",,
AMBEX PHARMA,pharmacy,"Arnaldo Blvd., Brgy. Tanque, Roxas, Capiz",,
MARLENE'S PHARMACY & MEDICAL SUPPLIES,pharmacy,"Don Joaquin Village, Sipalay, Negros Occidental",,
NEGROS GRACE PHARMACY,pharmacy,"V.S. Ong & Sons Bldg. 3rd Araneta St., Brgy. Poblacion, Bago City, Bago, Negros Occidental",,
KING PHARMACY,pharmacy,"Rizal St., Guimbal, Iloilo",,
J.D.N. PHARMACY,pharmacy,"Dr. B, Angelina Bldg., Bangga Sawmill, Brgy. Bata, Bacolod, Negros Occidental",,
THE GENERICS PHARMACY,pharmacy,"BJ Commercial Bldg, Poblacion Ilaya, Panay, Capiz",,
DOC'S BCM PHARMACY,pharmacy,"Araneta St., Barotac Nuevo, Iloilo",,
Mercury Drug,pharmacy,"G/F G005-06 GT Town Center, VP Fernando Lopez Avenue, Brgy. Ungka II, Pavia, Iloilo",,
MAYO'S PHARMACY,pharmacy,"S&Y Building, POBLACION TAKAS, Cuartero, Capiz",,
MERCURY DRUG,pharmacy,"Gov. Villavert St., Barangay 8, San Jose, Antique",,
JDN PHARMACY,pharmacy,"Plaza Burgos, Burgos St., Brgy. 9, Bacolod, Negros Occidental",,
MEDICAL MISSION GROUP HOSPITALS AND HEALTH SERVICES COOPERATIVE OF AKLAN PHARMACY,pharmacy,"San Lorenzo Drive, Toting Reyes, Kalibo, Aklan",,
C. CORDERO DRUG,pharmacy,"Dueñas Public Market, Dueñas, Dueñas, Iloilo",,
AJK PHARMACY,pharmacy,"Balucuan, Dao, Capiz",,
V'SANDROS PHARMACY,pharmacy,"Cabrera Compound, Lupa, Sitio Cubay, Brgy. Guinhalaran, Silay, Negros Occidental",,
 CAREHEALTH PHARMACY,pharmacy,"Taft Street, Brgy. Poblacion, Dumalag, Capiz",,
VLV Pharmacy and Medical Supplies,pharmacy,"Lopez Jaena Street, Barangay 4, Hinigaran, Negros Occidental",,
HEALTH WATCH PHARMACY,pharmacy,"Brgy. Libo-on-Gonzales, Guimbal, Iloilo",,
MERCURY DRUG,pharmacy,"Dr. Montano F. Doyo Building, #269 Arroyo St., Barangay Railway, District of La Paz, Iloilo City, Iloilo",,
MERCURY DRUG,pharmacy,"Araneta St., Purok San Miguel, Brgy. Sum-ag, Bacolod, Negros Occidental",,
APPROMED DRUGSTORE,pharmacy,"Barangay Rizal, Jordan, Guimaras",,
R. ALOVERA'S PHARMACY,pharmacy,"D-9 Teodoro Arcenas Trade Center, Roxas, Capiz",,
LHL PHARMACY,pharmacy,"Villareal Hi-way, Poblacion Proper, Mambusao, Capiz",,
FAMILYHEALTH & BEAUTY CORP.,pharmacy,"GF City Mall Parola Iloilo, Paprola Wharf, Muelle Loney, Port Area, Brgy. Concepcion City Proper, Iloilo City, Iloilo",,
BIOMEDIX PHARMACY AND SUPPLIES,pharmacy,"RSP Bldg., T. A. Fornier St., Brgy. 7, San Jose, Antique",,
THE GENERICS PHARMACY,pharmacy,"A-39 Luna St., Public Market, Hinigaran, Negros Occidental",,
GLEAMS PHARMACY,pharmacy,"Brgy. Tabao Proper, Brgy. Tabao, Valladolid, Negros Occidental",,
GENERAL NUTRITION CENTER (GNC) NATURAL HEALTH PHARMACY,pharmacy,"Level 1-Unit 90 South Wing Robinson's Place, Brgy. Mandalagan, Bacolod, Negros Occidental",,
THE GENERICS PHARMACY,pharmacy,"Barangay Yapak, Boracay Island, Malay, Aklan",,
N.R. SOLIDUM DRUGSTORE,pharmacy,"Ibajay Public Market, Dalisay Street, Poblacion, Ibajay, Aklan",,
ANGEL PREM PHARMACY,pharmacy,"Brgy. Dalid, Calinog, Iloilo",,
TRI O PHARMA INCORPORATED,pharmacy,"Barangay Atabay, San Jose, Antique",,
I.S. MEDICINE CORNER,pharmacy,"QHP Commercial Complex, Gen.Luna St., Iloilo City, Iloilo",,
CRISBERN DRUGSTORE,pharmacy,"144 Abanilla St.,Brgy.  Jalandoni Estate, Lapuz, Iloilo City, Iloilo",,
ILOILO GRACE PHARMACY,pharmacy,"C & J Building, Jalandoni  Extension, Bolilao, Mandurriao, Iloilo City, Iloilo",,
JADIS PHARMACY,pharmacy,"Purok. Crotons A, Brgy. Old, Sagay, Negros Occidental",,
MERCURY DRUG,pharmacy,"M. H. Del Pilar St., Molo, Iloilo City, Iloilo",,
"WATSONS PERSONAL CARE STORES (PHILS) INC.,",pharmacy,"MALL AREA, SM CITY BACOLOD RECLAMATION AREA, BACOLOD CITY, NEGROS OCCIDENTAL, Bacolod, Negros Occidental",,
MERCURY DRUG,pharmacy,"Roxas Avenue, Kalibo, Aklan",,
AG PHARMACY,pharmacy,"Gomez St., Pontevedra, Negros Occidental",,
NEGROS GRACE PHARMACY,pharmacy,"Vertland Bldg., San Juan St., Brgy. 10, Bacolod, Negros Occidental",,
ILOILO GRACE PHARMACY,pharmacy,"Brgy. Mamhut Sur, Balasan, Iloilo",,
MARLO'S PHARMACY,pharmacy,"Cadiz City Public Market, Poblacion, Cadiz, Negros Occidental",,
MADALAG TEACHERS' MULTI-PURPOSE COOPERATIVE ,pharmacy,"Nabor St., Poblacion, Madalag, Aklan",,
EMANON PHARMACY,pharmacy,"P. D. Monfort North, Dumangas, Iloilo",,
MERCURY DRUG,pharmacy,"Dumalag Road, Brgy. Poblacion, Tabuc, Mambusao, Capiz",,
ROSE PHARMACY,pharmacy,"Don Victorino Salcedo St., Barangay Poblacion Market, Sara, Iloilo",,
"PUREGOLD PRICE CLUB, INC.",pharmacy,"Prk. Laurel, Hernaez St., Mansilingan, Bacolod, Negros Occidental",,
FASTLANE DRUGSTORE & MEDICAL CLINIC,pharmacy,"Tirol Bldg., Rizal St., Maasin, Iloilo",,
SUJAN'S PHARMACY,pharmacy,"Lot 1, Block 3, Zone 1, Margarita-Everlasting St., Bo. Obrero, Lapuz, Iloilo City, Iloilo",,
NEGROS GRACE PHARMACY 8880,pharmacy,"Abelarde St., Z-4, Cadiz, Negros Occidental",,
THE GENERICS PHARMACY,pharmacy,"San Geronimo St., Tapaz, Capiz",,
"HUA KONG CHINESE DRUG & TRADING, INC.",pharmacy,"S-2 SM Hypermarket, Bacolod, Negros Occidental",,
COMPLETESOLUTION PHARMACY AND GENERAL MERCHANDISE,pharmacy,"39 MABINI STREET, DOOR 3 RICAMONTE BLDG., BRGY. LIBERATION, Iloilo City, Aklan",,
NEGROS GRACE PHARMACY,pharmacy,"Corner Yunque-Virto Sts., La Carlota, Negros Occidental",,
THE GENERICS PHARMACY,pharmacy,"Reil Bldg., Lacson St., Poblacion, Manapla, Negros Occidental",,
PHARMASEA DRUGSTORE,pharmacy,"Pueblo De Panay, Barangay Lawa-an, Roxas, Capiz",,
THE GENERICS PHARMACY,pharmacy,"888 China Town Mall Annex Bldg., Barangay 8, Bacolod, Negros Occidental",,
MERCURY DRUG,pharmacy,"MST Building, Rizal Street, Barangay IV Poblacion, Hinigaran, Negros Occidental",,
RYV PHARMACY,pharmacy,"Zone 1, Brgy. Nabulao, Sipalay, Negros Occidental",,
MERCURY DRUG,pharmacy,"Roxas Avenue corner L. Barrios Street, Poblacion, Kalibo, Aklan",,
MERCURY DRUG,pharmacy,"G/F West Arcade, Robinson's Place Bacolod, Lacson St., Barangay Mandalagan, Bacolod, Negros Occidental",,
ACEL PHARMACY,pharmacy,"Atabay, Brgy. 2, San Jose, Antique",,
BOTICA TIANGHA,pharmacy,"San Miguel, Jordan, Guimaras",,
GENERIKA DRUGSTORE,pharmacy,"Toting Reyes Street, Andagao, Kalibo, Aklan",,
GALT'Z MEDICAL CLINIC AND PHARMACY,pharmacy,"New Site, San Miguel, Jordan, Guimaras",,
Familymed Pharma,pharmacy,"Sto. Rosario, Buenavista, Guimaras",,
SUPER K DRUG CORPORATION,pharmacy,"Poblacion Ilaya, Dao, Capiz",,
MEDPLUS PHARMACY,pharmacy,"HLJ Bldg., cor. Sola St., J.Y Perez Highway, 2 , Kabankalan, Negros Occidental",,
MERCURY DRUG,pharmacy,"Plaza Libertad, Brgy. Ortiz, Iloilo City, Iloilo",,
FOURMULA  1+ BOTIKA NG BAYAN (F1+ BNB),pharmacy,"San Antonio Street, Brgy. Zone II, Tubungan, Iloilo",,
ROSHEL PHARMACY,pharmacy,"Poblacion II, Hamtic, Antique",,
JOSA PHARMACY,pharmacy,"Stall No. 2,  Public Market, Barotac Nuevo, Iloilo",,
FARMACIA RAFAELA,pharmacy,"Purok Bangga Totong 2, Brgy. Felisa, Bacolod, Negros Occidental",,
CLINIVA DRUGSTORE,pharmacy,"Zamora St., Barangay Ilaud Poblacion, Barotac Nuevo, Iloilo",,
FAMILYHEALTH & BEAUTY CORP.,pharmacy,"Supermarket Area, Savemore Market GT Town Center Pavia, Zone 02 Brgy. Ungka II, Pavia, Iloilo",,
SENTRO PHARMACY,pharmacy,"Stall 119 &120 Pototan Commercial Complex, San Jose St., Pototan, Iloilo",,
3JE DRUGSTORE ,pharmacy,"Victorias Commerical Center, Ascalon St., Brgy. II (Poblacion I), Victorias, Negros Occidental",,
MEDVALUE PHARMACY,pharmacy,"Poblacion, Tibiao, Antique",,
THE GENERICS PHARMACY,pharmacy,"Lopues Araneta Bldg., Araneta St., Bacolod, Negros Occidental",,
CONFLUENCE HEALTH & WELLNESS PRODUCTS ,pharmacy,"LGF SM City, Brgy. Bolilao, Mandurriao, Iloilo City, Iloilo",,
JORQUE PHARMACY,pharmacy,"Brgy. Poblacion, Banate, Iloilo",,
I.S MEDICINE CORNER,pharmacy,"Valeria Street, Brgy. Edganzon, Iloilo City, Iloilo",,
"WATSONS PERSONAL CARE STORES (PHILS) INC.,",pharmacy,"Supermarket Area SM City Bacolod, Reclamation Area, Bacolod, Negros Occidental",,
THE GENERICS PHARMACY,pharmacy,"Ambulong, Brgy. Manoc-Manoc, Malay, Aklan",,
NOEME PHARMACY,pharmacy,"National Highway, Suba, Calatrava, Negros Occidental",,
NJP PHARMACY,pharmacy,"Stall # 6 Miagao Public Market, Legaspi St., Miagao, Iloilo",,
CLG PHARMACY,pharmacy,"Delgado St., Iloilo City, Iloilo",,
RX QUEEN PHARMACY,pharmacy,"PCPM (Passi City Public Market) Main Passi City, Passi, Iloilo",,
MERCURY DRUG,pharmacy,"Jose Alba Building, Mabini St., Barangay Poblacion, Kalibo, Aklan",,
CDCC PHARMACY,pharmacy,"Funda-Dalipe, San Jose, Antique",,
GENERIKA DRUGSTORE,pharmacy,"Iznart Budget Superstore Corp., Barangay Yulo-Arroyo, Iloilo City, Iloilo",,
MVT PHARMACY,pharmacy,"Gomez St., Barangay 2 Poblacion, Moises Padilla, Negros Occidental",,
FARMACIA LOLITA DE ISABELA,pharmacy,"Public Market, Magallanes St., Isabela, Negros Occidental",,
SOUTH STAR DRUG,pharmacy,"Robinson's Supermarket, Molo GT Mall, M. H. Del Pilar St. Molo, Iloilo City, Iloilo",,
MERCURY DRUG ,pharmacy,"Del Rosario St., Balasan, Iloilo",,
NEGROS GRACE PHARMACY 8880,pharmacy,"Lopez Jaena St., Brgy. 1, Hinigaran, Negros Occidental",,
GENERIKA DRUGSTORE,pharmacy,"Lucero St., Poblacion Ilaya, Lambunao, Iloilo",,
GALVAN PHARMACY,pharmacy,"Barangay 01 - Roxas Street, San Miguel, Iloilo",,
PIERIL'S PHARMACY,pharmacy,"Mabini St., Kalibo, Aklan",,
FAMILYHEALTH & BEAUTY CORP.,pharmacy,"Ground Level, Yulo Bldg., Along JM Basa St., Barangay Ortiz, Iloilo City, Iloilo",,
PE PHARMACY,pharmacy,"Gov. A.T. Lim Avenue, Poblacion, Tibiao, Antique",,
BILLONES DRUGSTORE,pharmacy,"Lopez Jaena St., Brgy. 1, Hinigaran, Negros Occidental",,
MERCURY DRUG,pharmacy,"DCDM Bldg., Don Victorino Salcedo St., Brgy. Poblacion, Ilawod, Sara, Iloilo",,
HONEY'S RESIDENTIAL DRUGSTORE,pharmacy,"Hanglid, President Roxas, Capiz",,
SSG PHARMACY,pharmacy,"Bermejo St., Cabatuan, Iloilo",,
The Generics Pharmacy,pharmacy,"Bermejo St., Cabatuan, Iloilo",,
MOSLEM DRUGSTORE,pharmacy,"Sipalay Public Market, Brgy. 1, Sipalay, Negros Occidental",,
The Generics Pharmacy,pharmacy,"Masacote Bldg., Aquino Nobleza St., Janiuay, Iloilo",,
THE GENERICS PHARMACY,pharmacy,"Merzci Bldg, Bonifacio St., Barangay Zone-12, Bacolod, Negros Occidental",,
Mercury Drug,pharmacy,"SIL-GFS-4&5, Ground Floor, Gaisano Grand Mall, Rizal St., Barangay Mambulac, Silay, Negros Occidental",,
THE GENERICS PHARMACY,pharmacy,"Simeon Aguilar St., Brgy. Poblacion Ilawod, Passi, Iloilo",,
SMJ-I PHARMART,pharmacy,"Purok Acacia, Brgy.  Zone II, Murcia, Murcia, Negros Occidental",,
MERCURY DRUG ,pharmacy,"Del Rosario St., Balasan, Iloilo",,
RIGHT AID PHARMACY,pharmacy,"JM Basa St., Barangay Basa-Mabini-Bonifacio, Dumangas, Iloilo",,
PINK PHARMA & MEDICAL SUPPLIES,pharmacy,"Centro Pojo (Pob.), Bugasong, Antique, Bugasong, Antique",,
GENERIKA DRUGSTORE,pharmacy,"Unit 1, Dumalag Road, Poblacion Tabuc, Mambusao, Capiz",,
BGC PHARMACY,pharmacy,"Rizal St., La Paz, Iloilo City, Iloilo",,
GENERIKA DRUGSTORE,pharmacy,"COR. YUNQUE - VIRTO STREET., BRGY.II, POBLACION, LA CARLOTA CITY, La Carlota, Negros Occidental",,
MEDEXPRESS DRUGSTORE,pharmacy,"TDHI Clinic Central, B.S. Aquino Drive, Barangay Villamonte, Bacolod, Negros Occidental",,
R & E,pharmacy,"Salvani street, , Poblacion, Patnongon, Antique",,
SYMIEL'S MEDICINE CORNER,pharmacy,"8-A Yulo Drive, Sta. Filomena, Arevalo, Iloilo City, Iloilo",,
NEGROS GRACE PHARMACY,pharmacy,"Burgos-Hilado Streets, Bacolod, Negros Occidental",,
MERCURY DRUG,pharmacy,"Plaza Libertad, Brgy. Ortiz, Iloilo City, Iloilo",,
NEGROS GRACE PHARMACY,pharmacy,"G/F Lopue's East Centre, Burgos Hilado St., National Highway, Barangay Villamonte, Bacolod, Negros Occidental",,
BEAZ PHARMACY AND MEDICAL CLINIC,pharmacy,"J. T. Bretaña St., Ilaya Pob., Barotac Nuevo, Iloilo",,
Negros Grace Pharmacy,pharmacy,"Purok Jasmin, National Highway, Balintawak, Escalante, Negros Occidental",,
STO. NIÑO DE AREVALO DRUGSTORE,pharmacy,"19 Bonifacio St., Arevalo, Iloilo City, Iloilo",,
MERCURY DRUG,pharmacy,"Dumalag Road, Brgy. Poblacion, Tabuc, Mambusao, Capiz",,
NEGROS GRACE PHARMACY,pharmacy,"Araneta St. , Sum-ag, Bacolod, Negros Occidental",,
DOS PHARMA DISTRIBUTOR,pharmacy,"Castor St., Poblacion Market, Sara, Iloilo",,
LOIZ PHARMACY,pharmacy,"AGS Bldg., Hibao-an Norte, Mandurriao, Iloilo City, Iloilo",,
Simonne's Pharmacy,pharmacy,"Millan Bldg., J.Y. Perez Avenue, 1, Kabankalan, Negros Occidental",,
GBX PHARMACY,pharmacy,"Binalbagan Public Market, Don Pedro Yulo St., Brgy. San Pedro, Binalbagan, Negros Occidental",,
The Generics Pharmacy,pharmacy,"Abelarde St., Brgy. Zone 3, Cadiz, Negros Occidental",,
LILIA'S PHARMACY,pharmacy,"Sitio Lucap, Brgy. Mabigo, Canlaon, Negros Occidental",,
GALT'Z MEDICAL CLINIC AND PHARMACY,pharmacy,"Pro Emmanuel Building, New Site, San Miguel, Jordan, Guimaras",,
GOODY'S DRUGSTORE,pharmacy,"Cor. Salvani- Alvaniz St. Poblacion, Patnongon, Antique",,
ILOILO GRACE PHARMACY,pharmacy,"C & J Building, Jalandoni  Extension, Bolilao, Mandurriao, Iloilo City, Iloilo",,
FERVET PHARMACY,pharmacy,"Public Market, President Roxas, Capiz",,
THE GENERICS PHARMACY,pharmacy,"G/F Carpark-Coop. Area, Lopue's East Center, Burgos St. cor. Circumferential Rd., Bacolod, Negros Occidental",,
HENRIETTA DRUGSTORE,pharmacy,"Purok 4, Aguisan, Himamaylan, Negros Occidental",,
REMI D PHARMACY,pharmacy,"Barangay Poblacion Sur, Sigma, Capiz",,
JYS RETAIL AND WHOLESALE PHARMACY,pharmacy,"Door #1, Insularlife Townhouse 21st St., B.S. Aquino Drive., Brgy. 5, Bacolod, Negros Occidental",,
SOUTH STAR DRUG,pharmacy,"Robinson Supermarket, Alijis Road, Carmenville Subd., Barangay Mansilingan, Bacolod, Negros Occidental",,
JJAD PHARMACY,pharmacy,"Poblacion, Buruanga, Aklan",,
MERCURY DRUG,pharmacy,"Emigdio Nietes Avenue, Brgy. Funda Dalipe, San Jose, Antique",,
SUPER K DRUG,pharmacy,"Bantud, Barangay Manocmanoc, Boracay Island, Malay, Aklan",,
STO. ROSARIO DRUGSTORE 1,pharmacy,"Kapitan Sabi Mabini St., Talisay, Negros Occidental",,
GRACE PHARMACY,pharmacy,"L1369 A B2 Bacolod Granada Road, (Beside Metro Bacolod Hospital), Brgy. Estefania, Bacolod, Negros Occidental",,
FAMILYHEALTH & BEAUTY CORP.,pharmacy,"GF Sacred Heart Place, Barangay Q. Abeto-Mirasol, Mandurriao, Iloilo City, Iloilo",,
NEGROS GRACE PHARMACY,pharmacy,"National Highway, Purok Jasmin, Brgy. Balintawak, Escalante, Negros Occidental",,
PALMES PHARMACY,pharmacy,"Palmes Bldg., Luna St., Brgy. San Nicolas, Lapaz, Iloilo City, Iloilo",,
MD PHARMACY,pharmacy,"Tres Fuentes, Rizal St., Silay, Negros Occidental",,
APTEK PHARMACY ,pharmacy,"Pojo, Bugasong, Antique",,
CDCC PHARMACY,pharmacy,"Funda-Dalipe, San Jose, Antique",,
FAMILYHEALTH & BEAUTY CORP.,pharmacy,"Ground Floor City Mall Victorias, Osmeña Ave. , Victorias, Negros Occidental",,
The Generics Pharmacy,pharmacy,"Rizal St.  (La Carlota - La Castellana Highway), Robles, La Castellana, Negros Occidental",,
Mercury Drug,pharmacy,"Del Rosario St., Balasan, Iloilo",,
ZAINEN DRUGSTORE,pharmacy,"Block #12, Escalante City Shopp, Balintawak, Escalante, Negros Occidental",,
FARMACIA ELENITA,pharmacy,"Public Market, Poblacion, Cauayan, Negros Occidental",,
MERCURY DRUG,pharmacy,"Jetty Port, Caticlan, Malay, Aklan",,
MOMMY JOY PHARMA-MART,pharmacy,"Purok Dap-Dap, Barangay Poblacion, Valladolid, Negros Occidental",,
Kiel Pharmacy,pharmacy,"Ipil Street, Cubay, Barbaza, Antique",,
SDP DRUGSTORE,pharmacy,"Hard Bldg., Merlo Street, Brgy. Zone II, Santa Barbara, Iloilo",,
BOTIKA AMARIS,pharmacy,"Barangay IV, Victorias, Negros Occidental",,
CHME BOTIKA MART,pharmacy,"Bangga Rose Lawn, Purok Masinadyahon, Brgy. Bata, Bacolod, Negros Occidental",,
MERCY GRACE DRUGSTORE,pharmacy,"Barangay 1 (Pob.), Sipalay, Negros Occidental",,
GENERIKA DRUGSTORE,pharmacy,"TGIC Bldg. Hilado-Burgos Sts., Purok Avocado, Barangay 20, Bacolod, Negros Occidental",,
888 DRUGCARE PHARMACY,pharmacy,"Unit 3 #58 Gonzaga St., Brgy. Purok IV, Pavia, Iloilo",,
"ASCLEPIUS DRUGSTORE, MEDICAL LABORATORIES AND ALLIED SERVICES CO.",pharmacy,"Rm. 7, Adelina Bldg. corner General Luna-Jalandoni Sts., Iloilo City, Iloilo",,
A.M SAN AGUSTIN PHARMACY,pharmacy,"Barangay Poblacion, Valladolid, Negros Occidental",,
GAB'S PHARMACY,pharmacy,"Blk. 27 Lot 11 Ph. 4, NHA Village, Brgy. Pahanocoy, Bacolod, Negros Occidental",,
LISATAN DRUGSTORE,pharmacy,"Araneta St., Sum-ag, Bacolod, Negros Occidental",,
THE GENERICS PHARMACY,pharmacy,"Door 2, Victoria F. Gensoli Bldg. Burgos St., Barangay Villamonte, Bacolod, Negros Occidental",,
GENERIKA DRUGSTORE,pharmacy,"Lot 571-C Purok Masagana, Araneta St., Barangay Sum-ag, Bacolod, Negros Occidental",,
CONFLUENCE HEALTH & WELLNESS PRODUCTS,pharmacy,"Brgy. Tagbac, Jaro, Iloilo City, Iloilo",,
RSTAR PHARMACY,pharmacy,"Yanson St., Zone 7, Pulupandan, Negros Occidental",,
LAINE'S PHARMACY,pharmacy,"Public Market, Isabela, Negros Occidental",,
SUPER K DUG-XIX,pharmacy,"VILLA RICA BUSINESS PARK, BARANGAY BANICA, Roxas, Capiz",,
THE GENERICS PHARMACY,pharmacy,"Corner North Drive San Juan St., Brgy. 2, Bacolod, Negros Occidental",,
RIAM PHARMACY,pharmacy,"LADRIDO ST., POBLACION ILAWOD, Lambunao, Iloilo",,
THE GENERICS PHARMACY,pharmacy,"Medina St., Brgy. 4, San Carlos, Negros Occidental",,
PRODRUG PHARMACY,pharmacy,"Stall #30 Mina Public Market, Brgy. Cabalabaguan, Mina, Iloilo",,
ST. ANTHONY DE PADUA DRUGSTORE,pharmacy,"PAZ AVENUE, CANETOWN SUBDIVISION, BARANGAY 19-A, Victorias, Negros Occidental",,
458 PHARMACY,pharmacy,"Casa Juancho Building, Centro Poblacion, Culasi, Antique",,
MOTUS PHARMACY,pharmacy,"Toting Reyes St., Kalibo, Aklan",,
REGG'S PHARMACY,pharmacy,"Block 2 Lot 4, Capt. Sabi Street, Carmela Valley Homes, Zone 12, Talisay, Negros Occidental",,
MERCURY DRUG,pharmacy,"Quimpo Bldg., Archbishop Reyes St., Poblacion, Kalibo, Aklan",,
THE GENERICS PHARMACY,pharmacy,"54 Osmeña Ave., Brgy. II, Victorias, Negros Occidental",,
JM PHARMACY,pharmacy,"Maquiling St., Brgy. Barangay Purok IV, Pavia, Iloilo",,
NEGROS GRACE PHARMACY,pharmacy,"Gatuslao-Ballesteros Sts., Bacolod, Negros Occidental",,
GENERIKA DRUGSTORE,pharmacy,"Rep. Salazar St., Brgy. 5, San Jose De Buenavista, San Jose, Antique",,
SAVEMED PHARMACY,pharmacy,"Clement St., Brgy. Poblacion Zone II, Estancia, Iloilo",,
CHME BOTIKA MART,pharmacy,"Corner Rodriguez -Yulo St., Purok Million Flower, Brgy. 34, Bacolod, Negros Occidental",,
DOLLETE DRUGMART,pharmacy,"Panitan Public Market, Brgy. Tabuc Sur, Panitan, Capiz",,
Mercury Drug,pharmacy,"Rizal St., Guimbal, Iloilo",,
THE GENERICS PHARMACY,pharmacy,"Zone 2, Brgy. Ungka, Iloilo City, Iloilo",,
HERVAS DRUGSTORE,pharmacy,"Public Market, Salvacion St., Brgy. Poblacion Ilaya, Passi, Iloilo",,
Mercury Drug,pharmacy,"Brgy. Tagbak, Jaro, Iloilo City, Iloilo",,
THE GENERICS PHARMACY,pharmacy,"Yunque St., Brgy. I, Poblacion, La Carlota, Negros Occidental",,
Negros Grace Pharmacy,pharmacy,"Lopues Annex Bldg., Lacson St., Mandalagan, Bacolod, Negros Occidental",,
THE GENERICS PHARMACY,pharmacy,"Rizal St., Barotac Viejo, Iloilo",,
ROSE PHARMACY,pharmacy,"G/F Gaisano M.P. San Roque Ext., Roxas, Capiz",,
SUPER K DRUG VI,pharmacy,"Roxas Ave., Roxas, Capiz",,
H AND S DRUG CORPORATION,pharmacy,"Jocson Bldg., Bonifacio Street, Brgy. Zone 4-A, Talisay, Negros Occidental",,
DOMINICS PHARMACY,pharmacy,"M. CHAVEZ, San Lorenzo, Guimaras",,
SUPER K DRUG,pharmacy,"Bantud, Barangay Manocmanoc, Malay, Aklan",,
CLAK Pharmacy,pharmacy,"Brgy. Poblacion, Lopez Jaena St. Molo, Iloilo City, Iloilo City, Iloilo",,
GENERIKA DRUGSTORE,pharmacy,"Barangay Zone III,Villena St. , Cadiz, Negros Occidental",,
FOURMULA 1 + BOTIKA NG BAYAN (F1+BNB),pharmacy,"Poblacion, Libertad, Antique",,
"ROSE PHARMACY, INCORPORATED",pharmacy,"132 J.M. Basa St., Iloilo City, Iloilo",,
GRACIETA DRUGSTORE,pharmacy,"Purok 4, Aguisan, Himamaylan, Negros Occidental",,
GENERIKA DRUGSTORE,pharmacy,"Barangay Aquino Nobleza East, Janiuay, Iloilo",,
LORLE PHARMACY,pharmacy,"#48 Cabalfin St., Poblacion, Leon, Iloilo",,
MERCURY DRUG,pharmacy,"Plaza Libertad, Brgy. Ortiz, Iloilo City, Iloilo",,
I S MEDICINE CORNER,pharmacy,"ICDC Building, City Mall, Barangay Ungka II, Pavia, Iloilo",,
GENERIKA DRUGSTORE,pharmacy,"2F Tower A, One Global Center Bldg., Megaworld Ave. cor. Cyber St., Iloilo Business Park, Brgy. Buhang Taft North, Mandurriao, Iloilo City, Iloilo",,
PILAR BEATA PHARMACY,pharmacy,"Rizal Street, Poblacion, Pilar, Capiz",,
Farmacia Renia,pharmacy,"Brgy. Aganan, Pavia, Brgy. Aganan, Pavia, Iloilo",,
THE GENERICS PHARMACY,pharmacy,"Stall 58 Kalibo Shopping Center, Poblacion, Kalibo, Aklan",,
I AM PHARMACY,pharmacy,"Brgy. Hanglid, President Roxas, Capiz",,
FAMILYHEALTH & BEAUTY CORP.,pharmacy,"Supermarket Area Savemore Market San Carlos, Locsin St., Brgy. IV, San Carlos, Negros Occidental",,
THE GENERRICS PHARMACY,pharmacy,"#13 Peripheral. Iloilo Central Market, Aldeguer Street, Brgy. Nonoy, Iloilo City, Iloilo",,
"ASCLEPIUS DRUGSTORE, MEDICAL LABORATORIES AND ALLIED SERVICES CO.",pharmacy,"Rm. 7, Adelina Bldg. corner General Luna-Jalandoni Sts., Iloilo City, Iloilo",,
T.R.I DRUGSTORE,pharmacy,"Rizal, Jordan, Guimaras",,
NEGROS GRACE PHARMACY,pharmacy,"Lot 2 Blk. 2, Bacolod Murcia Road, Brgy. Mansilingan, Bacolod, Negros Occidental",,
CAMALLAN PHARMACY,pharmacy,"50 R. Tabiana St., Poblacion, Leon, Iloilo",,
THE GENERICS PHARMACY,pharmacy,"San Jose St., Pototan, Iloilo",,
NEGROS GRACE PHARMACY,pharmacy,"Lopue's San Sebastian St., Bacolod, Negros Occidental",,
NEGROS GRACE PHARMACY 8880,pharmacy,"Lopue's San Sebastian Bldg., Brgy. Gargato, Hinigaran, Negros Occidental",,
EMV DRUGSTORE,pharmacy,"Public Market, Enrique B. Magalona, Negros Occidental",,
Botika Amaris,pharmacy,"2nd Floor, MJY Bldg., Sofia Gonzaga St., Estefania, Bacolod, Negros Occidental",,
Negros Grace Pharmacy,pharmacy,"lot 2 blk. 2 bacolod murcia road, Brgy. Mansilingan, Bacolod, Negros Occidental",,
A & M MEDCARE PRODUCT DISTRIBUTORS,pharmacy,"5th-Lacson Street, Barangay 17, Bacolod, Negros Occidental",,
FAMILYHEALTH & BEAUTY CORP.,pharmacy,"Ground level, Kingsmen Building, located along Roxas Ave., Barangay Poblacion, Kalibo, Aklan",,
SAMEI PHARMACY,pharmacy,"Brgy. Sto. Nino Sur, Arevalo, Iloilo City, Iloilo",,
BABE DELA CRUZ PHARMACY,pharmacy,"No. 343 National Highway cor. Burgos St., Public Market, Poblacion Makato, Kalibo, Aklan",,
SOUTH STAR DRUG,pharmacy,"3rd Floor, Iloilo Supermart Bldg., Brgy. North San Jose, Molo, Iloilo City, Iloilo",,
MARCO Y DRUG,pharmacy,"MS-69 TATC, San Roque Ext., Roxas, Capiz",,
THE GENERICS PHARMACY,pharmacy,"Centro Poblacion, Culasi, Antique",,
CABANAS DRUGSTORE,pharmacy,"Barangay 1, Ilog, Negros Occidental",,
SA-VER'S CORNER DRUG,pharmacy,"Ibajay Public Market, Dalisay St., Poblacion, Ibajay, Aklan",,
FARMACIA TRONZON,pharmacy,"Dayao, Brgy. Dayao, Roxas, Capiz",,
MVV PHARMACY,pharmacy,"#104 San Sebastian - Doña Juliana Sts., Purok Chrysantemum, Brgy. 33, Bacolod, Negros Occidental",,
The Generics Pharmacy,pharmacy,"Rizal St, Barangay Ilawod, Pontevedra, Capiz",,
MERCURY DRUG,pharmacy,"AANDA Bldg., Araneta St., Brgy. Poblacion, Bago, Negros Occidental",,
NEGROS GRACE PHARMACY,pharmacy,"Socorro Real Estate Bldg., Brgy. 12, Bacolod, Negros Occidental",,
FAMILYHEALTH & BEAUTY CORP.,pharmacy,"GF SM Hypermarket Handumanan Bacolod, NEDF, Zone 4, Brgy. Handumanan, Bacolod, Negros Occidental",,
MERCURY DRUG,pharmacy,"Jetty Port, Caticlan, Malay, Aklan",,
KEN'S PHARMACY,pharmacy,"Barangay Culasi, Ajuy, Iloilo",,
FAMILYHEALTH & BEAUTY CORP.,pharmacy,"G/F City Mall Passi, Brgy. Poblacion Ilawod, Passi, Iloilo",,
FARMACIA GINETE,pharmacy,"Alvarez St., Brgy. Zone 7, Pulupandan, Negros Occidental",,
FASTLANE DRUGSTORE & MEDICAL CLINIC,pharmacy,"Barangay Ungka II, Pavia, Iloilo",,
GENERIKA DRUGSTORE,pharmacy,"Brgy. Zone III, Villena St., Cadiz, Negros Occidental",,
PET JAN PHARMACY,pharmacy,"Brgy. San Lucas, Barotac Viejo, Iloilo",,
SOUTH STAR DRUG,pharmacy,"Level 1 00147-00148, Robinson's Place, Pueblo De Panay, Brgy. Lawa-an, Roxas, Capiz",,
JODALYN'S PHARMACY,pharmacy,"Tigbauan Public Market, Tigbauan, Iloilo",,
FC PHARMACY,pharmacy,"Magallanes St., Brgy. III, Roxas, Capiz",,
G AND Z PHARMA,pharmacy,"Taft St., Brgy. III, Roxas, Capiz",,
CCRJ COMPANY,pharmacy,"Sitio Tollhouse, Barangay San Lucas, Barotac Viejo, Iloilo",,
TEKSERV PHARMACY,pharmacy,"IPZ Building, Barangay 1, Kabankalan, Negros Occidental",,
ROSE PHARMACY,pharmacy,"N2 Prince Hypermart, Brgy. Libot, Calinog, Iloilo",,
KEA PHARMACY,pharmacy,"Public Market, SWA, President Roxas, Capiz",,
NJP PHARMACY,pharmacy,"Peñaranda St., Brgy. Baybay Sur, Miagao, Iloilo",,
NEGROS GRACE PHARMACY,pharmacy,"Daalco Bldg., Mercedes Avenue, Brgy. 40, Bacolod, Negros Occidental",,
CENTRAMED PHARMACY,pharmacy,"Duenas Public Market, Dueñas, Iloilo",,
